rating,title,text,location,num_contributions,date
5,Charmosa,"Uma praia charmosa e atraente. O acesso não é dos mais fáceis mas agrada em cheio aqueles, que como eu, curtem uma praia mais selvagem e deserta. Não possui infra estrutura mas proporciona muita tranquilidade.","Curitiba, PR",846,7 de julho de 2016
3,Praia tranquila.,"Praia  de pouco agito, muito verde nas proximidades. Ideal para quem quer fugir da aglomeração de pessoas. Em certos pontos altos, tem boas visão de paisagens .","Blumenau, SC",46,4 de julho de 2016
5,a melhor praia da Penha,"Praia pra quem gosta de bastante árvores fazendo aquela sombrinha gostosa, aquela praia calma sem onda....praia maravilhosa","Navegantes, SC",12,2 de julho de 2016
5,Praia linda e calma,Excelente lugar para levar sua família sem se preocupar com ambulantes ou ter que disputar espaços com outros banhistas. amplo estacionamento nas ruas próximas. Contudo havia poucos lugares para comer.,,8,21 de junho de 2016
5,Praia Calma,"O local é extremamente agradável, bem preservado. Não tem muvuca e agito como em outras praias, pois ela é bem pequena. A paisagem é muito linda. Vale muito a visita. O ideal é levar seus próprios alimentos e sacolinhas de lixo, pois o local não tem infraestrutura para turistas.","Blumenau, SC",57,15 de junho de 2016
4,Vale uma visita,"Praia muito pequena e de difícil acesso mas com lugares muito bonitos. Como é uma área de preservação, não possui muita estrutura, as pessoas levam seus alimentos para passar o dia. Existe um único ponto de comércio no local. Mas pela beleza, vale uma visita.","Brasília, DF",241,27 de maio de 2016
4,lindo lugar,com o seu difícil acesso só melhora o charme o lugar ! Lindo e tranquilo para passar um excelente dia em família ou com amigos !,"Florianópolis, SC",37,10 de maio de 2016
4,Tranquilidade,"Praia mais isolada, com acesso mais complicado. Em Agosto está vazia, só nossa família por lá... tranquilidade é sinônimo de Penha. Gostamos tanto que estamos saindo de São Paulo capital para ir morar lá!","São Paulo, SP",71,30 de abril de 2016
5,Calma e tranquila,"Praia de águas calmas e tranquilas... Perfeito para uma cervejinha e um marisco... na praia há somente um bar, que não é aberto o ano todo. Na alta temporada nos finais de semanas é bastante cheio.","Penha, SC",33,28 de abril de 2016
5,Muito linda,"A praia da paciência é muito conhecida na região, por possuir águas bem calmas e uma vista muito linda.","Navegantes, SC",31,27 de abril de 2016
4,"Bela, mas abandonada","Uma praia pequena, porém mal conservada. Apesar disso é um bom local para sentar e provar os mariscos oriundos do próprio local.","Penha, SC",253,26 de abril de 2016
4,Bem tranquila e ótima para crianças!,"O acesso é chatinho, mas a praia é uma delícia. Ótima para crianças, pois é pequena, tem árvores que fazem sombra, e por ser formato de ferradura, não tem ondas!","Rio de Janeiro, RJ",17,26 de abril de 2016
5,Deliciosa,Praia pequena porem mansa para criancas mas a unica lanchonete q a atende tem poucas opcoes apesar do preco justo.,"Bragança Paulista, SP",32,26 de abril de 2016
4,Praia deliciosa,"Um praia pequena mas deliciosa, as ondas quase não chegam protegidas por um costão ao lado direito. Ótimo para crianças. Precisa levar lanches e bebidas pois a estrutura limita-se a um quiosque nem sempre aberto.","Penha, SC",4,25 de abril de 2016
2,Falta estrutura,"Recebemos a indicação de amigos sobre esta praia e chegamos lá cheio de expectativas. Não sei se pelo fato do dia não estar ensolarado a impressão não foi muito boa. A praia é bem pequena mesmo (isso não é problema), é ótimo para quem vai com crianças porém não há estrutura nenhuma...O unico ""quiosque"" que poderia ter serviços de petiscos e bebidas estava fechado, o acesso á praia é um pouco precário e a mesma estava bem suja. Talvez em alta temporada a praia seja melhor.",,5,14 de abril de 2016
5,O nome diz tudo,"Pra quem busca tranquilidade, este lugar te proporcionará, sem dúvidas um lugar de muita paz que nos ajuda a ter mais paciência.","Itajaí, SC",28,7 de abril de 2016
4,Bonita,Uma prainha pequenina em meio a pedras com uma natureza linda . gostei muito do lugar. Acredito não ser bom ir com crianças pequenas mas com certeza os adolescentes irão gostar. O acesso se dá por uma estradinha de terra não muito boa.,"Itapema, SC",209,3 de abril de 2016
2,Nascer do sol,Fui ver o nascer do sol as 5am porém o lugar é deserto ( de casas e comércio)  é Mato pra todo lado. Não recomendo fazer isso de casal...talvez d grupo O lugar é lindo de manhã ( voltei as 13). Mas é muito carente de tudo.,"São Paulo, SP",161,3 de abril de 2016
5,Adoro praia,Penha tem suas belezas e esta pequena praia é muito legal para ir com a família ou companheiro. Recomendo.,"Blumenau, SC",997,31 de março de 2016
5,Linda praia,"Praia pequena,  inclusive chamada pelos moradores de Penha como a ""menos praia do mundo""... Águas calmas e lindo visual. Vale a visita","São Paulo, SP",32,28 de março de 2016
4,Calma,"É uma praia calma e relaxante, tem uma visão linda do mar. Como fui em época de frio não pude me banhar, mas fiquei admirado","São Paulo, SP",28,26 de março de 2016
4,Pequena e tranquila,"Essa praia tem uma faixa de área de cerca de 30 metros, é muito pequena. A água super tranquila, ótima para crianças. Como a praia é pequena, poucas pessoas já enchem a área, o que pode ser um problema na alta temporada.","São José dos Campos, SP",154,21 de março de 2016
4,Bonita,"Praia bonita e bem pequena. Legal porque forma umas piscinas rasas, porém para poder usufruir é necessário chegar muito cedo, pois é muito pequeno e suporta poucas pessoas, logo apenas visitamos, mas valeu a pena.","Caxias Do Sul, RS",16,15 de março de 2016
4,Praia excelente para crianças,"é uma praia calma , parada, própria para quem tem crianças, recomendo é ótima e muito limpa, tem pouco movimento também","Penha, SC",29,14 de março de 2016
4,Bem legal,"Gostamos muito das praias de Santa Catarina , algumas com águas mais calmas outras mais agitadas, mas muito boas.","Porto Alegre, RS",24,12 de março de 2016
4,Proximo a cidade com aguas calmas,"A praia possui acesso bem proximo a cidade, é muito pequena e com estacionamento limitado. Possui aguas calmas e cristalinas","Rio de Janeiro, RJ",740,12 de março de 2016
2,pequena e feia,"Acesso só de carro, e mesmo assim se não tiver chovido um dia antes, pois tem um barranco enorme. O único ponto forte são as várias arvores que te dão sombra natural.","Santos, SP",506,12 de março de 2016
3,Não gostei,"Tem o título de menor praia do mundo, como menor praia do mundo tem um trecho mínimo de areia e muitos curiosos para conhecer, sem contar que se chover ficam milhares de algas enroscando nas pernas que dá tanto nervoso que não consegui ficar 5 minutos dentro da água.","Rio de Janeiro, RJ",24,9 de março de 2016
5,Calma!,"Praia calma, mar tranquilo, paisagem linda. Ideal para famílias que desejam passar um dia fazendo piquenique, jogando bola, volei...","Penha, SC",27,8 de março de 2016
4,linda praia,"Praia tranquila, agua limpinha. ambiente bem agradável,só que atrapalha um pouco que é uma praia com aquelas algas marinhas, mas tirando isso fica perfeita. Nota 8","Mogi das Cruzes, SP",2,6 de março de 2016
3,Paciencia para chegar,"A praia da paciência é bonita porém o empenho para chegar lá não vale a pena. É uma praia pequena, acesso por estrada de chão bastante estreita sendo que em alguns pontos a largura do acesso não comporta dois carros, sem falar na descida que é bastante íngreme. Não tem acesso pela praia para quem gosta de caminhada, apenas para ver, entrar no mar ou tomar sol na areia.","Curitiba, PR",34,2 de março de 2016
3,Não vale a ida,"Praia com faixa de areia pequena, muito lixo deixado pelos turistas, cheiro forte de peixe e o mar não é dos melhores para o banho, em Penha praia boa mesmo pra curtir é a praia grande e praia do poá.",,5,19 de fevereiro de 2016
5,fantastica!!,"linda praia, tivemos um dia maravilhoso em família. Tem apenas um quiosque, e de lá você vê a praia toda.... é bem pequena com poucas pessoas.... as crianças ficaram soltas a vontade e conseguíamos ficar de olho nelas.... muita tranquilidade. Praia sem onda, mas precisa tomar cuidado com as pedras..... Simplesmente maravilhoso!!!","São Paulo, SP",5,12 de fevereiro de 2016
5,cantinho paradisíaco,"fica muito perto da Pousada, 20' de caminhada, água quente, mar calmo, propício para pesca, ótimo para levar a criançada.","Blumenau, SC",15,11 de fevereiro de 2016
5,Praia bem calma e bonita,"Praia muito bonita e bem calma, não entrei na agua, passei de carro ... vale a pena conferir esta e outas praias próximas. A melhor é a das cabeçudas.","Vitória, ES",64,11 de fevereiro de 2016
5,MARAVILHOSO LUGAR,"Praia da paciência, é sem dúvida em minha opinião uma das melhores, aguas tranquilas, recomendo para familias, crianças, em alta temporada super lotada como agora, tem somente um barzinho que serve bebidas e petiscos. Lugar exuberante! Muito lindo, eu recomendo!","Brasília, DF",14,11 de fevereiro de 2016
4,Praia muito bacana,Uma praia que preenche  os requisitos para quem quer colocar  uma pesca misturada com lazer familiar!!! Mas lembre de levar lanches  e bebidas !!! No caminho passe na Petiscatia Do elio !!! Show de bola e preco justo !!!,,11,10 de fevereiro de 2016
4,Pequena e charmosa,Praia pequena com águas claras e calmas! Embora o trajeto seja de chão batido vale a pena passar um dia nesta praia!! recomendo,"Sorocaba, SP",312,9 de fevereiro de 2016
5,Praia Legal!,"Para quem não gosta de multidões, esta praia é ideal, pois tem um acesso não muito bom e é bem pequena, então é pouco movimentada, mas tem sua beleza e charme.","Campo Bom, RS",50,5 de fevereiro de 2016
4,Para Família,"Bom para ir com crianças, praia calma sem estrutura. E bom levar uns lanchinhos. E guarda-sol também! Acesso fácil.",,10,3 de fevereiro de 2016
4,Bonita e pequena,"A praia não permite a chegada de muitas pessoas, o local para estacionar é bem pequeno, se quiser conhecer, vá cedo. Meu filho foi andar nas pedras e cortou o pé, recomendo usar chinelos quando for andar nas pedras pois tem muitas cracas, vale a pena conhecer...","São Paulo, SP",214,27 de janeiro de 2016
1,praia ruin,"muito quieta, agua fedida, pouca onda, muito esgoto, poluicao alta na agua, sem salva vidas, areia suja.","Rondonópolis, MT",13,24 de janeiro de 2016
5,Linda só pra fotos,"Praia linda para fotos , não tem muita infraestrutura. Não é uma praia para se montar guarda sol e ficar o dia todo. A paisagem e belíssima. Vale fotos super bacanas, com piscinas pequenas naturais. Fica cheio no verão.","Ribeirão Preto, SP",132,19 de janeiro de 2016
3,"bonita, mas só para conhecer.","A praia é pequena e bonita, mas não dá para passar o dia. No dia em que visitamos o mar estava bravo. Algumas pessoas estavam acampadas na praia e havia um pouco de lixo no local.",,104,13 de janeiro de 2016
4,Pequena e Linda,"Pequena, mas linda praia. Fomos apenas conhecer, tirar fotos e não passar o dia. Deve comportar, não mais que 10 - 12 carros. Apesar de uma placa informando que é proibido acampar, havia vários usuários acampados.","Piracicaba, SP",119,8 de janeiro de 2016
4,"Linda, mas pouco preservada","A praia é pequena, encantadora, escondida na mata, lindas pedras, com cartazes de conscientização, mas ainda assim, percebi muito lixo, uma pena. Possivelmente o pessoal faz festas à noite, por ser um lugar único e belíssimo, bem reservado é pequeno, mas infelizmente não recolhem seus lixos...","Campinas, SP",138,4 de janeiro de 2016
5,Considerada a menor praia do Brasil,"A praia da paciência é uma praia com uma faixa de areia muito pequena, o acesso se dá por um morro de estrada de barro, a paisagem é sensacional, com encostas de pedras e águas cristalinas, conta com uma lanchonete que por vezes está fechada... Na praia também tem uma piscininha natural excelente para as crianças, para pesca e pra um bom banho de mar,um ótimo passeio em família! Recomendo!!!","Blumenau, SC",194,3 de janeiro de 2016
5,Excelente,"Pequena praia meio que escondida, com agua cristalina e piscinas naturais, muito linda, porem precisa chegar cedo para achar um bom lugar.","Hernandarias, Paraguai",412,30 de dezembro de 2015
2,Praia pequena com muitas algas,"Para família achamos a praia pequena, com difícil acesso,com muitas algas onde se torna inviável aos banhistas, acho até que a Prefeitura do Município da Penha  deveria avaliar o local para banho de pessoas, uma vez que sabemos que as algas devem ser levados pelo mar naturalmente, ao meu ver estamos invadindo um espaço da natureza. Porém o quiosque no local com bom atendimento e preços acessíveis. Se encontram no local nas áreas verdes algumas pessoas com barracas para camping,churrasqueiras, tomara que ao saírem mantenham o local limpo. Acho que nesse local a segurança deveria ser 24 horas.",,8,29 de dezembro de 2015
4,Muito tranquila,"Trata-se um praia bem tranquila e privativa. Quando estive lá, o único bar não estava funcionando.. Local bonito, mas para quem viaja com crianças, não aconselho, pois não há nenhuma estrutura...","Contagem, MG",52,28 de dezembro de 2015
5,Piquenique,"Praia paradisíaca,tem apenas um acesso por terra.Ideal para mergulho,pesca,acampar,fazer piquenique.","Penha, SC",68,17 de dezembro de 2015
5,amei,"Amei essa praia, como quase todas de santa Catarina. São limpas, organizadas. A unica coisa que achei um pouco estranha é que só vendem churros e milho...","São Paulo, SP",282,13 de dezembro de 2015
3,Difícil acesso,"A praia é distante e com difícil acesso. Não é das mais bonitas e não tem infra-estrutura, vale para quem curte lugares mais tranquilos e desertos.","Prudentópolis, PR",112,1 de dezembro de 2015
4,uma excelente praia,uma excelente praia. acho que posso dizer que é uma das melhores que ja fui. valeu a pena. recomendo e muito.,"Campinas, SP",133,22 de novembro de 2015
3,Pequena e tranquila,"Penha-SC não se destaca pela beleza de suas praias e sim pelo parque Beto Carrero World. Quem pretende viajar para curtir belas e estruturadas praias devem procurar outras cidades. As praias do balneário de Penha, são áreas de preservação ambiental e por isso não apresentam grande infraestrutura para seus frequentadores. Porém para os amantes da natureza elas podem se tornarem atraentes. A praia tem um acesso de dificuldade média e a paz e tranquilidade são os destaques da praia.","Marília, SP",131,19 de novembro de 2015
5,Otima Localização,"Passei um dia nessa praia e, mesmo não tendo muitas opções de lazer, é o suficiente para quem quer ter um dia tranquilo.",Estado de São Paulo,13,6 de novembro de 2015
4,Acesso mais complicado,"A Praia da Paciência fica em um local cercado de árvores e, portanto, de acesso mais complicado. Mas definitivamente vale a visita - e justamente pelo isolamento.","Curitiba, PR",360,2 de novembro de 2015
5,Lugar lindo,"LUgar delicioso, areia branquinha, tem arvores na areia que fazem sombra em determinada hora do dia... um lugar quase particular mas bem disputado.","Maringá, PR",28,31 de outubro de 2015
4,Praia para Ecoturismo,"Praia com muitas rocas, areia, floresta nativa da mata marina, mito recomendado para as pessoas que gostam do contato com a natureza.","Navegantes, SC",224,23 de outubro de 2015
