rating,title,text,location,num_contributions,date
4,Lindas águas,"Lugar lindo,  água com cor incrível.  Ponto negativo foi a quantidade de lixo que encontramos boiando, aparentemente a tendência é que a maré traga lixo que talvez nem sejam dessa praia mas acaba acumulando nessa praia. O bar é pequeno mas tem um cardápio ok., mas tudo frito. Necessário pagar estacionamento que pode chegar a 50 reais.","Indaiatuba, SP",361,6 de março de 2022
5,Praia linda,"Praia linda, mar calmo que não dá vontade de sair da água. Tem uma pequena estrutura com restaurante e estacionamento. O estacionamento é pago, oferece chuveirinho na rua e banheiro. Importante avisar que eles não aceitam cartão no pagamento do estacionamento, só dinheiro. E o valor varia de 30 a 50reais a diária(depende se é dia de semana oi fds). O restaurante oferece alguns petiscos e tem um cardápio não mto variado, mas da pra passar o dia. Os valores são os mesmos que a beira da praia da região, nada mto exorbitante. Tb vi que eles alugam cadeiras e guarda-sol","Porto Alegre, RS",5,4 de fevereiro de 2022
5,Prainha deliciosa,"Prainha deliciosa, com estacionamento e bar. Mas fomos a pé do Refúgio até lá ( cerca de 1 km ), e foi bem legal. Familiar, não tem muvuca. Só banho de mar e contemplação da natureza.","Ilhabela, SP",7,12 de janeiro de 2021
4,Agradável,"Praia pequena, muito bonita e agradável. Poucas pessoas no local e quase sem infraestrutura. Difícil acesso, em virtude da estrada. E o valor do estacionamento era bem salgado pelas condições do local. Mas vale a pena conhecer o local.","Passo Fundo, RS",21,26 de fevereiro de 2020
5,gostei,"boa praia, limpa, cristalina com pouca onda, tem a opção de pagar estacionamento ou largar o carro na estrada um pouco antes do estacionamento. pra quem larga o carro  na beira da estrada tem um acesso por uma trilha de 10 minutos mto bonita.. é uma decida tipo uma escada.. bem traquilo fazer a trilha... tem um quiosque lá, paguei 40 reais numa porção de peixe pra duas pessoas.","Porto Belo, SC",4,24 de janeiro de 2020
5,Muito legal!!,"Praia tranquila, com uma pequena faixa de areia. Há um caminho por trilha, e uma opção de descer de carro até um estacionamento (pagamos 25,00). Se você está com alguma Parafernalha, ou crianças, recomendo pagar os 25,00 do estacionamento. Vale a pena.","Criciúma, SC",43,16 de janeiro de 2020
4,"Praia de areia firme. a água do mar límpida e ondas que não nos arrastam,Mar seguro.","Estive no início de janeiro de 2020. passei todo o dia, com a família. Informo que não acreditem na palavra do rapaz que fornece cadeiras e barracas, disse-nos que o que foi pago seria descontado na consumação da lanchonete do local., Nada foi descontado. Fora esse engodo, a praia é excelente. Já havia ido lá no verão passado e retornarei.","Curitiba, PR",33,16 de janeiro de 2020
5,Bela praia,"A praia do ESTALEIRINHO de porto belo tem acesso por uma trilha pela mata . Trilha acompanha um condomínio de casas. Não é fácil pois escorrega devido umidade da. Mata. O condomínio libera estacionamento na temporada de verão,porem cobra . Praia pequena, super limpa . Tem uma barraca / lanchonete do condomínio que atende a praia em geral. Aceita cartão de crédito.","São José dos Pinhais, PR",6,15 de janeiro de 2020
3,Boa praia pra quem estiver disposto a conhecer,A praia do estaleiro tem uma água muito linda com ondas bem tranquilas pra quem for banhar. A área de praia em si é um pouco pequena podendo ficar bem lotada em algumas épocas do ano. Ela fica um pouco afastada da cidade de Porto Belo passando por estradinhas bem estreitas porém com uma vista bem bonita. O local tem estacionamento pra carro e na minha visita o valor era 25 reais pro dia todo.,"Timbó, SC",2,3 de janeiro de 2020
5,Praia estaleiro,Lugar paradisíaco lindo espetacular e tranquilo para descansar com a família e filhos lugar maravilhoso,"Mafra, SC",14,14 de dezembro de 2019
5,Estaleiro,"A praia é  linda, limpa, água cristalina, mar calml, com muito sossego, à também um trapiche no qual você pode pular. Ótimo para passar um domingo","Itapema, SC",130,23 de novembro de 2019
5,Um primor de praia,"Aguas límpidas num  pequeno espaço charmoso de praia, apenas um local para atender pedidos de bebidas e petiscos e nem sempre encontra-se aberto, portanto, vá preparado com suas necessidades pois poderá náo encontrar nada disponível no local, e também preparado para uma trilha até a praia com boa inclinação, e com boa disposição e saúde chegará sem maiores dificuldades...Tendo sorte, e conforme a vontade do zelador local, poderá encontrar o estacionamento aberto o que facilita o acesso.","Porto Belo, SC",7,8 de maio de 2019
5,Praia do Estaleiro Porto Belo SC,"Uma praia paradisíaca de águas cristalinas, um local tranquilo e maravilhoso! possui quiosque de praia e estacionamento, ideal para banhos de mar, prática de esportes á remo, mergulho de contemplação.","Porto Belo, SC",18,7 de maio de 2019
5,Maravilhosa,Uma das mais belas praias do litoral Catarinense. Aguas límpidas e pouquíssimas ondas.frequentada por famílias. Possui restaurante que serve na praia.,,15,19 de março de 2019
5,Lindo lugar,"O difícil acesso é compensado totalmente pela linda natureza. Água verde, pouca gente. Estacionamento privado oferecido por vizinhos.","Capão da Canoa, RS",10,16 de março de 2019
1,Luto,"A praia infelizmente, deixou de ser um local pra descansar,  pois com tantas divulgações o lugar infestou de gente! Parem de divulgar lugares calmos pra encher de gente barulhenta e mau educada!","Joinville, SC",23,25 de fevereiro de 2019
5,Melhor Praia,"Fomos a bombinhas passar a semana, e no último dia fomos a porto belo visitar uma praia diferente, apesar da estrada ruim para chegar até a praia do Estaleiro, a praia é surpreendente, muito bonita, mar calmo, o bar que fica anexo à praia (apesar de não aceitarem cartões) é muito bom, comida boa, bebida pra todos os gostos e os atendentes bem divertidos e atenciosos! Recomendadíssimo a praia do Estaleiro, como disse no título nos surpreendeu e ficou como a melhor praia da viagem, pra fechar com chave de ouro!","Bombas, SC",24,15 de fevereiro de 2019
5,Praia do Estaleiro the best,"com certeza a praia que surpreende em beleza, e quando esta vento sul então é paraíso total, mar fica daquele jeito que você não quer ir embora ...Vale muito conhecer e desfrutar deste local privilegiado dentro do município de  Porto Belo. passeio imperdível. volto sempre !",Santa Catarina,36,13 de fevereiro de 2019
5,Incrível,"Vale o dia e o passeio, água cristalina, peixes nadando ao redor, um restaurante com comida saborosa e uma paisagem exuberante.","Santo Ângelo, RS",24,12 de fevereiro de 2019
5,Lindo Lugar,"Muito linda a praia, água cristalina, mar manso, lugar tranquilo com a família e crianças. Estacionamento R$ 20,00 a diária. Não tem muita estrutura, mas possui um restaurante com preços acessíveis, servindo na praia, atento que só aceitam dinheiro. Bem próximo tem um trapiche, onde mergulhamos com as crianças. Vale muito a pena. Recomendo!!!","Itajaí, SC",31,11 de fevereiro de 2019
5,Linda Praia,Linda Praia. Lugar preservado e com acesso fácil através do estacionamento particular   que há no local. 20 reais.  Mar calmo e água clara. Vale a pena conhecer.,"Blumenau, SC",52,1 de fevereiro de 2019
5,Linda praia... natureza exuberante mar azul,"Praia de aguas cristalinas. Mar tranquilo, excelente para banho. Paisagem muito linda. Tem 1 bar de apoio. Não servem refeições, so petiscos e lanches. Os Camarões estava deliciosos! Preços menores que na regiao. Atenção Só aceitam dinheiro. Estacionamento 20 reais. Aluguel guarda sol e cadeiras 30. Faltou uma ducha de agua doce! Mar muito bom para crianças pequenas! Raso e tranquilo. Considerada a praia/agua mais limpa da regiao. Vale muito a pena conhecer","Brasília, DF",47,24 de janeiro de 2019
5,Point reservado bom para o mergulho,"Localizada no final da estrada que leva às parias de Bomas e Bombinhas, a Praia do Estaleiro só é acessível descendo uma picada na mata com certa dificuldade. Isso favorece o seu isolamento, que garante a integridade de suas características.","Rio de Janeiro, RJ",21,22 de janeiro de 2019
5,Lugar Maravilhoso,Experiência linda! Praia limpa! Agora com facilidade de acesso por um estacionamento particular (20 reais a diária)! Vale a pena conhecer!!,"Umuarama, PR",21,13 de janeiro de 2019
4,Praia tranquila,"para acessar a praia temos duas opções , por uma trilha ingrime que para voltar cansa um pouco porem tem outro acesso para carros com local para estacionar, a aparaia é limpa e tranquila uma boa opção em Porto Belo","Campo Bom, RS",68,9 de janeiro de 2019
5,Melhor Praia da Região,"Sem dúvidas, a melhor praia da região. Agua verdinha, limpíssima e areia fininha bem branca. Para acessar à praia é necessário passar por uma propriedade particular. A pé acho que não tem custo, mas para estacionar o carro lá dentro, custa R$20,00/dia. Vale a pena.","Curitiba, PR",133,20 de novembro de 2018
5,Linda praia,"Após uma trilha de 5 min de descida, chega-se a uma linda praia, com águas limpas, que vale a visita.","Curitiba, PR",12,6 de outubro de 2018
5,Lugar Unico,"Um verdadeiro paraíso no bairro mais charmoso de Porto Belo, o bairro  Araçá é um verdadeiro covite a desfrutar o melhor do litoral brasileiro.","Porto Belo, SC",8,27 de agosto de 2018
5,Uma amiga,Tempo já que não vou mas aí ... Mas já estou com saudades sou uma velha amiga que morava aí mas nunca deixei de hi o dono da antiga casa que mora agora deve ter um pequeno restaurante minha família chamava de pipoca se ele vê esse comentário sou filha do neldo que morava no Gil.. sou a Catiele bourscheid entra em contato com nos 😘,,1,23 de agosto de 2018
5,Paraíso!!!,"Uma praia super tranquila,ótima pra mergulhar e curtir as maravilhas do mar, peixinhos coloridos...água transparente...depois que descobri esse pedaço do paraíso só vou nessa, simplesmente AMOOOOOO","Porto Belo, SC",132,3 de julho de 2018
5,Praia maravilhosa,Praia maravilhosa. Super indico fazer a rota inter-praias. Várias praias com visões paradisíacas. Indicado para todas as pessoas,"Florianópolis, SC",59,26 de março de 2018
4,Lugar incrivel,Pra quem curte natureza e o lugar ideal Melhor praia de Porto belo e a água mais cristalina Porém peca em um pouco de infraestrutura,"Cabo Frio, RJ",74,17 de março de 2018
5,Praia Maravilhosa,"Melhor Praia que fui na minha vida , Lá a agitação é calma e de difícil acesso o que ajuda para alguém que procura descanso",,7,8 de março de 2018
5,"Praia calma, água quente","Praia agradável para criancas, com servico de praia suportado por uma lanchonete local.Vale conhecer.","São Paulo, SP",276,6 de março de 2018
5,Praia maravilhosa !!!,"Praia com dois acessos , pelo estacionamento indo de carro e pagando 20,00 para passar o dia ou então pela trilha mas não é um acesso muito fácil , mas todo esforço vale a pena, porque a praia é maravilhosa , água limpa e transparente , mar calmo e pra quem mergulha então é muito show . Tem umas árvores que dá apoio para a sombra , mas recomendo levar toda estrutura de praia ( cadeira, guarda sol ) lá tem um quiosque . É pequena a praia mas sua beleza é grande .","Balneário Camboriú, SC",1,19 de fevereiro de 2018
4,Pequena e bem fequentada,"A praia é de fácil acesso se entrar pelo estacionamento particular, mas se for descer pela trilha prepare-se, pois será cansativo. Tem aproximadamente 400 metros de areia com águas calmas e bem frequentada. Tem um bom restaurante que disponibiliza cadeiras, guarda-sol, mesas, petiscos e bebidas. Normalmente alguns locais que tem barcos ou jet-ski atracam lá para aproveitar o dia.","São Paulo, SP",37,16 de fevereiro de 2018
5,Melhor praia de Porto Belo,"Mar espetacular, transparente, dá pra ver a sombra das embarcações no fundo. Excelente ponto de mergulho. Ondas fraquinhas, ideal para quem tem crianças. Ponto de fundeio, mas fique de olho na maré, há pouco espaço para girar.","Joinville, SC",5,13 de fevereiro de 2018
5,Praia Paradisiaca,Na minha opiniao é a melhor praia da regiao. O mar é uma piscina. Tem um barzinho que serve bons petiscos por um otimo preço,,4,3 de fevereiro de 2018
5,Praia-piscina,"A praia é um pequeno paraíso, com água clara e calma, com uma pequena extensão de areia. É bom chegar cedo para garantir um bom lugar e longe da maré quando ela subir. Escolha um local mais acima para não ter problemas com a maré. Para chegar até a praia, precisa enfrentar uma estradinha bem estreita e íngreme. O local oferece um ambiente família, ideal para crianças se divertirem. Existe um pequeno restaurante rústico, com atendimento direto na areia pelos atendentes. Não é preciso levar nem cadeiras e guarda-sol. O local também abriga pontos para atividades de mergulho, para quem quiser se aventurar. Para quem aprecia fotografia, é possível tirar boas fotos da natureza ao redor.","Curitiba, PR",22,23 de janeiro de 2018
5,Perfeição,"lindo local, praia quase deserta, limpa e com uma vista top, quiosque com atendimento na areia e com boas opções. voltaremos com maior prazer.","Cachoeirinha, RS",88,11 de janeiro de 2018
4,Passei,Muito lindo poucas ondas mar caumo vou recomendar aos amigos notei que a antiga trilha que leva a uma caminha mamata foi fechada dis o segurança que agora é ária particular qui pena era muito bom fazer caminhadas ali,,1,7 de dezembro de 2017
3,Linda vista,"A vista é linda, água cristalina, não vi duchas, não observei se tem salva vidas,pelo menos passamos bastante tempo na praia e não vi, o mar no dia que fomos estava um pouco bravo, não sei se é sempre assim, mas valeu muito a visita, os preços praticados pelos ambulantes não são atraentes","Navegantes, SC",166,20 de novembro de 2017
5,Aguas Cristalina,Praia excelente para banho e para curtir a vista e natureza. O acesso é feito por uma trilha com algumas escadas A água é cristalina e o local é bem preservado,"Xangri-Lá, RS",77,5 de novembro de 2017
5,Vista linda,Praia de aguas claras esverdeadas com muito verde ao redor com uma trilha de acesso e no verão tem a baiuca do pipoca que é um barzinho que serve petiscos e refeições saborosas a um preço justo.,,46,8 de setembro de 2017
5,Praia do Estaleiro - Porto Belo - SC,"Melhor água do Sul do Brasil! Cristalina, alegre e com um costão ótimo para mergulhar em segurança e ver toda a beleza submarina. Pequena, propicia a união entre os veranistas e um barzinho, simples e prático com petiscos saborosissimos...","Porto Belo, SC",9,31 de agosto de 2017
5,Praia limpa e bela.,"Praia sensacional com visual lindo, poucas ondas e calma....excelente para passar o dia com a família, sempre que vou a santa catarina passamos pela praia do estaleirinho para passar o dia, almoçar é sempre uma ótima experiencia.",,43,6 de junho de 2017
4,Praia,Sensacional o visual e a natureza Água limpa e tranquila Bom acesso fora de temporada Boa gastronomia,,3,4 de maio de 2017
4,Praia maravilhosa,"Espetacular é a definição da praia do estaleiro, águas calmas e cristalina, lugar lindo com uma pequena faixa de areia branca, e pedras pra embelezar ainda mais o lugar, peixes que nadam com você, um ótimo restaurante com porções variadas e bebidas, vale muito a pena conhecer e levar a família e amigos. Obs: o local é de difícil acesso, talvez precise pedir informações.",,39,28 de abril de 2017
5,Praia paradisica e praticamente deserta.,"Praia paradisica, praticamente deserta e com ondas bem pequenas. Dificil acesso. Uns 3 km a frente da entrada da Praia da Caixa D'Aço, para o carro na rua e desce uma trilha de uns 300mtrs( só de descida), ou, se tiver condições, diretamente pelo mar com  barcos. Não recomendável se tiver carregando muitas coisas ou pesos. hahaha. Se bem que a vista vale todo o esforço. Tem um unico bar logo que vc chega na praia. o di em que fui não estava funcionando. Não indicado ir em dias chuvosos, pois a trilha é bem ingrime, com pedras escorregadias e alguma parte com barro.","Curitiba, PR",12,26 de abril de 2017
4,Escondida,"Para chegar nesta praia, é necessário pegar a estrada de acesso para o Caixa dAço. Deixe o carro lá no final, e siga a trilha. A trilha é no meio do mato, mas bem fácil. A praia e maravilhosa, e dependendo do dia, n˜o haverá mais ninguém por lá alem de você!","Iguape, SP",1,13 de abril de 2017
5,Exuberante,"Praia exclusiva, um achado!!!! Mar cristalino, com peixes coloridos, muito bom para mergulhar. Local com estacionamento e restaurante. Uma das mais lindas que já conheci !!! Recomendo !!!!! Cuidado para nao passar da entrada, vai foto do portal.","Florianópolis, SC",108,10 de março de 2017
5,Vale muito a pena!!!,"Vale a pena conhecer... mar calmo e muito limpo. Praia tranquila, sem muvuca. Cenário maravilhoso!!!",,34,7 de março de 2017
5,Mar bravo,"Praia boa , sem muvuca , restaurantes confortáveis , gente bonita , valeu a ida , lugar top e aconchegante","Itatinga, SP",280,4 de março de 2017
5,Local paradisíaco,"òtima praia, não costuma encher muito, água cristalina, acesso bom, asfaltado e com calçamento, somente na entrada da praia, na área de estacionamento(R$20) uma subidinha ingrime.","Pelotas, RS",298,1 de março de 2017
4,Melhor de Porto Belo,"Melhor praia de Porto Belo, tranquila e limpíssima, pode-se ter acesso por uma área particular, onde é cobrado e tem vagas de estacionamento, porém há uma trilha alternativa de apenas 300mts que na minha opinião é muito mais atrativo.. vale a visita","Bombinhas, SC",34,17 de fevereiro de 2017
4,"Praia mais reservada, em uma das partes mais lindas de Porto Belo, porém com resalvas","Localizada em uma das partes mais lindas de Porto Belo, a praia conta com uma estrutura para os turistas, porem ainda carece de mais atenção. Por estar localizada em uma área privada, o acesso custa R$20,00; tem estacionamento para carros porem sem muita organização e cuidados - chão batido, com dificuldade para subir quando chove; possuem restaurante no local, preços turisticos; a praia em si é muito bonita, com mar limpo, exceto na temporada de algas e quando esta agitado ou ventando muito; Local cheio na alta temporada, portanto se seu objetivo é passar o dia todo na praia, chegue cedo. A vantagem está no fato de ser uma praia pequena e mais reservada, pagar para ter acesso tem suas vantagens mas isso não garante a qualidade. Não possuem serviço de aluguel de guarda-sol ou cadeiras, portanto para quem está despreparado, será dificil passar o dia aqui; A estrada de acesso até o local não é das melhoras: parte asfaltada, parte estrada de chao - aqui novamente a chuva pode ser um problema.","Curitiba, PR",666,16 de fevereiro de 2017
5,magnifico,"Praia maravilhosa areias brancas àgua cristalina...imperdível!!!! Existem trilhas belíssimas para os amantes do esporte, enfim algo que precisam conhecer.","Porto Belo, SC",6,2 de fevereiro de 2017
4,Lugar lindo e ótimo para relaxar,"Estive na Praia do Estaleiro em Porto Belo por indicação de uma amiga. Não tive dificuldades para chegar à praia, pois a sinalização é boa. A praia é mais preservada e tem um estacionamento que dá para chegar de carro bem perto da praia. No meu caso eu deixei o carro lá em cima do morro e encarei a descida à pé. A praia é linda, mar verdinho e calmo. Tem muitas pedras lá que deixam o lugar mais selvagem e lindo para tirar fotos. Tem um bar/restaurante que servem petiscos gostosos e com preço justo. Quero voltar muitas vezes!","Itapema, SC",177,1 de fevereiro de 2017
5,Grata surpresa,"Escondida pela vegetação nativa, encontramos essa enseada e foi uma grata surpresa. Adoramos passar o dia lá. Águas calmas e cristalinas, ondas ideais para brincadeiras de crianças",,11,28 de janeiro de 2017
5,"um paraiso, lugar agradavel, sossegado, muito limpo por ser uma praia praticamente particular.","se voce procura sossego, descontracao, paz e uma praia maravilhosa, esse é o local. Os chales sao muito limpos e tem toda infra estrutura que voce precisa, é claro, para o seu conforto, recomendo que leve sua roupa de cama e banho. Se tiver equipamento de mergulho de superficie, leve e aproveite, mas se for mergulhador autonomo leve seu equipamento e desfrute da fauna e flora marinha do local. O caseiro pesca o peixe e prepara na hora se voce assim desejar. A noite, nao deixe ir pescar peixe espada, leve sua vara de pescar, molinete e garatéias, compre as iscas em Porto Belo, e boa pescaria. Nunca me diverti tanto, mas cuidado com os dentes deste peixe, use alicate para retira-lo do anzol. Enfim, desfrute e deixe o stressssssss.","Valinhos, SP",14,11 de janeiro de 2017
5,Praia linda,"Praia bonita, água agradável e a praia não é agitada. Vale à pena visitar. É cobrado estacionamento, 20 reais.",,9,7 de janeiro de 2017
4,Bom lugar,"A praia do Estaleiro é uma pequena praia na Colônia Araçá, em Porto Belo SC. Gasta-se R$ 10,00 para estacionar o carro, o que é recomendável, pois a estrada é bastante estreita. Em dias de bastante sol é um ótimo lugar para snorkeling, pois as águas ficam claras e o local não tem ondas muito fortes.","Curitiba, PR",24,27 de dezembro de 2016
5,maravilhoso,"Praia muito agradavel, otima pra passear com a familia, agua gostosa, ondas perfeitas e areia branca.",,24,20 de novembro de 2016
5,Paraíso.,"Frequento há 12 anos. Continua um paraíso. A Baiuca do Pipoca serve petiscos e pratos simples mas muito bons. A lula a dorê é minha preferida. Tem estacionamento perto da praia e vc não precisa mais descer a trilha. Perfeito para famílias com crianças pous a baía é pequena, águas tranquilas cercadas de verde.","Pomerode, SC",6,16 de novembro de 2016
5,Incrivel visibilidade para mergulho.,"Pequena praia que pode ser acessada por mar através das escunas que partem de Porto Belo, ou de carro você deve ir em direção a Bombinhas e fique atento logo que passar o iate clube peque a primeira rua a esquerda, são apróx. 1500 metros até a prainha, tem um estacionamento no local.  A praia tem areia clara, muitas pedras e um pequeno bar com banheiro,  leve um snorkel, a visibilidade para mergulho é incrível, para quem for de lancha vale a pena lembrar de soltar bastante cabo na ancora, a praia é bastante agitada e já presenciamos vários incidentes.","Porto Belo, SC",23,14 de novembro de 2016
5,Ponto para Mergulho,"Ótimo local para realização do mergulho subaquático, sendo um dos nossos pontos principais para a realização da atividade. Conhecimento  e diversão garantidas.",,6,1 de novembro de 2016
5,Linda,"Apesar de pequena, é linda demais e encanta! Aguas calmas e limpas, adoramos a tarde que ali passamos, lindo lugar para se admirar. Recomendo a visita sem duvidas!",,515,26 de setembro de 2016
5,Linda!!!,A pequena e tranquila Praia Estaleiro é muito linda!! O acesso é feito através de uma pequena trilha.,"Florianópolis, SC",650,6 de setembro de 2016
3,PRAIA   PEQUENA  MAIS  ENCANTA,pria que encanta   cuja praia  que fica alado  do paradouro mais conhecido   o  Caixa D'aço     estaleiro  acesso a praia tem acesso a praia por uma trilha que aproximadamente 10 minutos de caminhada   é uma praia  que se avista  Itapema Balneario Camboriu   mais  frequentada por pescadores de fim de semana  e pessoas  que querem sossego     e tramquilidade,"Tijucas, SC",42,26 de julho de 2016
5,A melhor praia para banho de Porto Belo,"Para chegar até esta praia é necessario fazer uma pequena trilha, uma praia super tranquila, agua apropriada para banho e uma bela paisagem, o trapiche possibilita um dos banhos de mar mais incriveis.","Florianópolis, SC",72,5 de julho de 2016
5,Linda praia,"Uma praia muito bonita e preservada, pequena, sem muito tumulto. Há apenas um restaurante, porém muito gostoso, vale a pena!","Itapema, SC",127,28 de junho de 2016
5,Deserta,"Uma praia com poucas pessoas, mas uma praia limpa e bonita cercada de mata atlântica, ótima para fica no sossego com a família",,31,12 de junho de 2016
3,Bonito. Acesso ruim,"local calmo, amplo espaço. Porém o acesso é ruim. Mas vale a pena. No dia não tinha serviço de guarda sol para alugar.","Tangará, SC",21,6 de junho de 2016
4,Bela paisagem,"Gostei muito desta praia. É uma praia bem pequena  muito bonita. Só tem acesso por uma pequena trilha, mas vale a descida.","São Paulo, SP",67,6 de maio de 2016
4,boa praia,"Praia limpa, um pouco longe do centro, algumas ondas, estacionamento pago. mas dá pra se divertir bastante.","Rio de Janeiro, RJ",9,1 de maio de 2016
5,Bonita,"Uma prainha tranquila, bonita com uma natureza linda como as demais dessa região, tem um restaurante ( não aceitam cartão). O lugar  bom para as crianças, por ser com pouco movimento. Gostei.","Itapema, SC",209,25 de abril de 2016
5,Praia sossegada!,"Local maravilhoso pra quem quer descansar, longe da badalação mas numa praia linda e maravilhosa, perfeita pra nadar, sem ondas.","Farroupilha, RS",47,2 de abril de 2016
5,Pira mais linda de todas.,"Pensa em uma praia linda. E essa.. A agua é muito limpa, como é de difícil acesso, poucas pessoas vão. Um show de praia.",,103,2 de abril de 2016
5,Uma delicia de refugio!,"A praia do estaleiro, é um ponto especial para nadar, e principalmente para mergulhar! Tem um bar e restaurante de apoio, com preços honestos e bom atendimento!","Palmas, TO",221,1 de abril de 2016
5,Praia,"Praia muito boa, água limpa para banho, tem faixa de areia extensa, bom lugar para família e para crianças","Balneário Camboriú, SC",2,29 de março de 2016
