rating,title,text,location,num_contributions,date
4,Praia ótima,A vista é linda e a praia é muito boa. O melhor é pegar o carro e sair conhecendo a região. O passeio pra ilha é imperdível.,"São Paulo, SP",59,26 de novembro de 2013
4,Muito bonita!,Fora de temporada pode ser apreciada com mais calma e comtemplada em toda sua beleza! vale a pena conhecer e fazer o passeio de barco!,"Curitiba, PR",151,28 de setembro de 2013
3,Calmo até demais,"O local é bonito mas não possui muitas opções de lazer e restaurantes, alguns locais eram impróprios para banho e o mar costumava trazer lixo que ficava na praia logo pela manhã até o pessoal da limpeza passar.","Chapecó, SC",38,23 de setembro de 2013
5,Encantadora,"A bucólica Porto Belo com sua enseada, seus recantos com uma natureza impressionante. Bons restaurantes e bares. Comércio diversificado. Não gosto da alta temporada em Porto Belo pelos grandes congestionamentos que se formam.","Lucca, Itália",19,11 de setembro de 2013
3,NADA PARA FAZER,"Porto Belo é um lugar muito tranquilo, com praias bonitas, mas a cidade é muito pequena e não tem nada alem de uma feirinha, o que é gostoso é caminhar pela praia que no final tem algumas pedras e dá para subir nela ou deitar sobre elas é bem legal.","São Paulo, SP",98,6 de setembro de 2013
3,"Já que tá aí vá para bombas, bombinhas",É bem perto e as praias outro nível... vale muito a pena passar o dia em 4 ilhas................................,"Niterói, RJ",232,5 de setembro de 2013
4,Cidade bonita,"Porto Belo é uma cidade histórica, tranquila fora da temporada e muito charmosa. Gostei de andar pela cidade que tem bastante opções de comércio e bons restaurantes. Também é perto de Bombas e Bombinhas, boas para passear quando se quer estar no agito. Porto Belo é daquelas cidades que dá vontade de morar.",,20,4 de setembro de 2013
3,Já que está tão perto...,Vá a bombinhas ou bombas onde se encontram as melhores praias... recomendo a 4 ilhas... magnífica............,"Niterói, RJ",311,3 de setembro de 2013
4,Tranquilidade,Porto Belo fora da temporada é muito tranquila e boa para curtir um fim de semana sossegado. A praia é ótima para uma caminhada no final da tarde.,"Blumenau, SC",360,29 de agosto de 2013
4,Praia de Porto Belo,"Praia de Porto Belo tem boa estrutura para o turista com bares e restaurantes, tem opção de passeio de barco, que pode descer ou não na Ilha de Porto Belo. É legal ir com os amigos ou a família e passar o dia na Ilha e conhecer o Museu que tem lá. Tem passeios de Kaiak muito mais. A cidade tem um comércio que atende as necessidades do turista, mas tem opções em cidades bem próximas que tem mais opções pras compras.","Pouso Alegre, MG",1,15 de agosto de 2013
2,Feia,"A praia nao é nada bonita, mas todas as praias vizinhas sao uma graca, em especial Bombinhas e Bombas ... Porto Belo é o centro onde moram os ""locais""/trabalhadores da regiao...","São Paulo, SP",79,10 de julho de 2013
4,praia,as praias de porto belo nao sao muito boas nao mas no fim do ano meados de novembro começam a temporadas dos transatlanticos um desfile de navios belissimos chegando a aportar uma media de 50  navios por temporada,"Itapema, SC",4,6 de julho de 2013
3,Não indicada para banho,"A praia não é boa para banho, mas ideal para descansar e fica mto próxima de Bombas e Bombinhas, as melhores para banho!","Rio Grande, RS",492,22 de maio de 2013
5,Sossego,Uma praia perfeita para quem quer mar calmo e curtir momentos com a família. As crianças adorarão poder mergulhar a vontade sem perigo. Um passeio de barco até a ilha é recomendável e trará ótimas lembranças.,"Joinville, SC",261,21 de maio de 2013
